{
  "pageId": "www.pricing",
  "surface": "www",
  "route": "/pricing",
  "version": 1,
  "sourceHash": "sha256:4cd80c117cb6468f1608b58bdcbce7f20f8bb10b80eb47d7ce34bb2df1036597",
  "keys": {
    "path": "/pricing",
    "meta_title": "ราคา | Vouus",
    "meta_description": "แผนราคาโปร่งใสสำหรับทีมที่ขยายเวิร์กโฟลว์ HR และการเงิน เปรียบเทียบแพ็กเกจ Foundation และเริ่มทดลองใช้ฟรี",
    "hero_title": "ราคาเรียบง่าย",
    "hero_title_line1": "ราคาเรียบง่าย",
    "hero_title_line2": "ระบบอัตโนมัติระดับมืออาชีพ",
    "hero_description": "เริ่มเล็ก ๆ ขยายบนแพลตฟอร์มเดียว",
    "cta_compare": "เปรียบเทียบแผน",
    "plans_heading": "เลือกแผนของคุณ",
    "plans_subheading": "เริ่มจากสิ่งจำเป็น เพิ่มความจุและระบบอัตโนมัติตามการเติบโต",
    "trial_link_text": "เริ่มทดลองใช้ฟรี",
    "trial_link_suffix": "— ยืนยันอีเมลที่ทำงาน แล้วดำเนินการออนบอร์ดต่อ",
    "billing_monthly": "รายเดือน",
    "billing_yearly": "รายปี",
    "billing_save_badge": "ประหยัด 10%",
    "contact_us_label": "ติดต่อเรา",
    "billed_annually_label": "เรียกเก็บรายปี",
    "save_prefix": "— ประหยัด",
    "percent_off_label": "(ลด 10%)",
    "module_accounting": "บัญชี",
    "module_hrms": "HRMS",
    "module_crm": "CRM",
    "plan_basic_name": "Basic",
    "plan_basic_tagline": "บัญชีเป็นระเบียบตั้งแต่วันแรก",
    "plan_basic_max_users": "สูงสุด 5 ผู้ใช้",
    "plan_basic_core_value": "ข้อมูลปฏิบัติการที่มีโครงสร้าง",
    "plan_basic_support": "สนับสนุนทางอีเมล",
    "plan_basic_cta": "เลือก Basic",
    "plan_professional_name": "Pro",
    "plan_professional_tagline": "เงินเดือนและการอนุมัติขนาดใหญ่",
    "plan_professional_badge": "แนะนำ",
    "plan_professional_max_users": "สูงสุด 20 ผู้ใช้",
    "plan_professional_core_value": "เงินเดือนและการขยายทีม",
    "plan_professional_support": "สนับสนุนแชท",
    "plan_professional_cta": "เลือก Pro",
    "plan_biz_name": "Business",
    "plan_biz_tagline": "สำหรับทีมขนาดกลางที่ต้องการวิเคราะห์และความจุเฉพาะ",
    "plan_biz_max_users": "สูงสุด 50 ผู้ใช้",
    "plan_biz_core_value": "Enterprise Analytics",
    "plan_biz_support": "โทรศัพท์/ผู้สนับสนุนเฉพาะ",
    "plan_biz_cta": "เลือก Business",
    "plan_enterprise_name": "Enterprise",
    "plan_enterprise_tagline": "สำหรับองค์กรขนาดใหญ่ที่ต้องการโครงสร้างพื้นฐานแยก",
    "plan_enterprise_max_users": "สูงสุด 100+ ผู้ใช้",
    "plan_enterprise_core_value": "โครงสร้างพื้นฐานเฉพาะ",
    "plan_enterprise_support": "ผู้จัดการสนับสนุนเฉพาะ",
    "plan_enterprise_cta": "ติดต่อเรา",
    "compare_heading": "เปรียบเทียบแผนและฟีเจอร์",
    "compare_subtitle_1": "ทุกแผนรวมการอนุมัติ บันทึกตรวจสอบ และระบบอัตโนมัติเวิร์กโฟลว์",
    "compare_subtitle_2": "ดูสิ่งที่รวมในแต่ละแผน คลิกชื่อแผนเพื่อสลับ",
    "compare_feature_column": "ฟีเจอร์",
    "compare_download_label": "ดาวน์โหลดแพ็กเกจที่เลือก",
    "compare_cat_Infra": "โครงสร้างพื้นฐาน",
    "compare_cat_Accounting": "บัญชี",
    "compare_cat_HR": "HR",
    "compare_cat_CRM": "CRM",
    "compare_cat_Email": "อีเมล",
    "compare_cat_Support": "การสนับสนุน",
    "compare_feat_infra_users": "ผู้ใช้",
    "compare_feat_infra_db_gb": "DB (GB)",
    "compare_feat_infra_file_gb": "ไฟล์ (GB)",
    "compare_feat_infra_app_ram": "แอป RAM (ตรรกะ)",
    "compare_feat_infra_db_ram_share": "แชร์ RAM DB",
    "compare_feat_infra_redis_share": "แชร์ Redis",
    "compare_feat_infra_tier": "ระดับโครงสร้างพื้นฐาน",
    "compare_feat_acct_accounting": "บัญชี",
    "compare_feat_acct_bookkeeping": "การทำบัญชี",
    "compare_feat_acct_invoice": "ใบแจ้งหนี้",
    "compare_feat_acct_auto_image_scan": "สแกนภาพอัตโนมัติ (ใบแจ้งหนี้ ใบเสร็จ)",
    "compare_feat_hr_attendance_leave": "เข้างาน/ลา",
    "compare_feat_hr_payroll": "เงินเดือน",
    "compare_feat_crm_sales_management": "การจัดการขาย",
    "compare_feat_email_send_communicate": "ส่งและสื่อสาร",
    "compare_feat_support_technical": "สนับสนุนทางเทคนิค",
    "compare_feat_support_i18n": "หลายภาษา",
    "compare_feat_support_remove_branding": "ลบแบรนด์",
    "compare_feat_support_early_access": "เข้าถึงฟีเจอร์ใหม่ก่อน",
    "compare_feat_support_attack_protection": "ป้องกันการโจมตี",
    "compare_feat_support_mfa": "การยืนยันตัวตนหลายปัจจัย",
    "faq_heading": "คำถามที่พบบ่อย",
    "faq_0_q": "การสมัครสมาชิกแพลตฟอร์มรวมอะไรบ้าง?",
    "faq_0_a": "ครอบคลุมโครงสร้างพื้นฐาน การปฏิบัติตามข้อมูล และโมดูล ERP หลัก แผนระดับสูงเพิ่มความจุ ทรัพยากรเฉพาะ และตัวเลือกสนับสนุนที่มากขึ้น",
    "faq_1_q": "ควรขยายอย่างไรเมื่อธุรกิจเติบโต?",
    "faq_1_a": "คุณสามารถอัปเกรดแผนเพื่อเพิ่มผู้ใช้ ความจุ และระดับการสนับสนุน เราจะช่วยเลือกแผนที่เหมาะสมตามการใช้งานและทีม",
    "faq_2_q": "มีข้อจำกัดผู้ใช้หรือระบบหรือไม่?",
    "faq_2_a": "แต่ละแพ็กเกจมีขีดจำกัดผู้ใช้ แต่การใช้ระบบ (คอมพิวต์/ที่เก็บ) ขยายได้ และมีตัวเลือกจ่ายตามการใช้งาน",
    "faq_3_q": "เริ่มเล็กแล้วขยายทีหลังได้ไหม?",
    "faq_3_a": "ได้ หลายทีมเริ่มจากแผนเล็กแล้วอัปเกรดเมื่อเพิ่มผู้ใช้และเวิร์กโฟลว์",
    "faq_4_q": "แผน Enterprise เหมาะกับใคร?",
    "faq_4_a": "ออกแบบสำหรับองค์กรขนาดใหญ่ที่ต้องการอินสแตนซ์เฉพาะ ติดตั้งภายใน หรือข้อกำหนดความปลอดภัยที่ต้องการสภาพแวดล้อมแยก",
    "faq_5_q": "รับชำระเงินด้วยวิธีใดบ้าง?",
    "faq_5_a": "รับบัตรเครดิตหลัก โอนธนาคาร และออกใบแจ้งหนี้สำหรับแผนรายปี ติดต่อเราสำหรับตัวเลือก Enterprise",
    "faq_6_q": "เปลี่ยนแผนกลางรอบบิลได้ไหม?",
    "faq_6_a": "ได้ การอัปเกรดมีผลทันที การลดระดับมีผลรอบบิลถัดไป อาจมีเครดิตตามสัดส่วน",
    "faq_7_q": "มีทดลองใช้ฟรีไหม?",
    "faq_7_a": "มี ทดลองใช้ฟรี 14 วันด้วย Pro เต็มรูปแบบ—ยืนยันอีเมลที่ทำงานและเริ่มออนบอร์ดในวันเดียวกัน ไม่ต้องใช้บัตรเครดิต",
    "faq_8_q": "เกินขีดจำกัดผู้ใช้จะเป็นอย่างไร?",
    "faq_8_a": "คุณสามารถอัปเกรดหรือเพิ่มผู้ใช้แบบจ่ายตามการใช้งาน เราจะแจ้งก่อนมีค่าใช้จ่ายเกิน",
    "faq_9_q": "มีส่วนลดรายปีไหม?",
    "faq_9_a": "มี การเรียกเก็บรายปีลด 10% เทียบกับรายเดือน"
  },
  "meta": {
    "productRepo": "infra-control-plane",
    "sourcePath": "src/marketing-pages/registry.ts pricing",
    "githubPath": "www/pricing.page.json",
    "translationStatus": "ai_draft",
    "method": "cursor-ai"
  }
}
