{
  "pageId": "app.onboarding",
  "surface": "app",
  "route": "/{companyId}/{locale}/onboarding",
  "version": 3,
  "sourceHash": "sha256:b53f73fa6f3a4256c798a4a33d9bdfa72b952e07346f76a7995d15efa3ac1399",
  "keys": {
    "title": "欢迎加入！",
    "language": "语言",
    "selectLanguage": "选择语言",
    "step1Title": "档案",
    "step2Title": "联系",
    "step3Title": "地址",
    "step4Title": "任职",
    "step5Title": "薪资",
    "step6Title": "年假",
    "step7Title": "确认",
    "step8Title": "数据审阅及法律提交同意 (Final Review & Affirmation)",
    "countryCodePlaceholder": "区号",
    "affirmationText": "最终审核与法律提交确认\n\n您输入的信息将作为正式人事记录登记。请在点击提交按钮前仔细核对详情并确认同意。",
    "consentButton": "同意并继续",
    "noticeLoadError": "无法加载告知内容，请刷新页面或重试。您仍可点击下方按钮继续。",
    "languageSelectLabel": "语言选择",
    "languageLabel": "语言",
    "emergencyContactSection": "紧急联系人",
    "reviewApproversSection": "审批人",
    "companyCheckLoading": "正在确认公司...",
    "companyNotReadyTitle": "暂未开放入职登记",
    "companyNotReadyMessage": "该公司尚未开通入职登记。请联系管理员。",
    "inviteInvalidTitle": "邀请不可用",
    "inviteNotFoundMessage": "此邀请链接已失效。管理员可能已发送更新的邀请 — 请查看最新邮件。",
    "inviteExpiredMessage": "此邀请链接已过期。请让管理员重新发送邀请邮件。",
    "inviteTenantUnavailableMessage": "该公司尚未完成入门设置。请联系管理员。",
    "invitePortalUserIncompleteMessage": "您的员工记录尚未就绪。请联系管理员。",
    "inviteGenericErrorMessage": "邀请链接无效。请检查邀请邮件。",
    "next": "下一步",
    "back": "返回",
    "submit": "提交",
    "companyName": "公司名称",
    "companyNameHint": "公司法定全称（例如 Acme Pte Ltd）。",
    "companyNamePlaceholder": "例如 Acme Pte Ltd",
    "legalEnglishName": "法定英文名",
    "firstName": "名",
    "firstNameHint": "仅字母，不含数字（例如 John）。",
    "firstNameEnglish": "名（英文）",
    "lastName": "姓",
    "lastNameHint": "仅字母，不含数字（例如 Smith）。",
    "lastNameEnglish": "姓（英文）",
    "nameFormatLabel": "请选择姓名格式",
    "nameFormatFirstMiddleLast": "名 / 中间名 / 姓",
    "nameFormatFullName": "全名",
    "middleName": "中间名（英文）",
    "middleNamePlaceholder": "例如 James",
    "nativeFirstName": "名（母语）",
    "nativeLastName": "姓（母语）",
    "nativeMiddleName": "中间名（母语）",
    "fullNameHint": "或者，在下方输入两个全名以完成姓名录入。",
    "englishFullName": "英文全名",
    "englishFullNamePlaceholder": "例如 John Smith",
    "nativeFullName": "母语全名",
    "nativeFullNamePlaceholder": "例如母语书写姓名",
    "nativeFullNameHintKo": "请输入韩文全名（例如 홍길동）。",
    "nativeLastNameJa": "姓（日文）",
    "nativeFirstNameJa": "名（日文）",
    "nativeFuriganaFamily": "姓（假名）",
    "nativeFuriganaGiven": "名（假名）",
    "nativeLastNameZh": "姓",
    "nativeFirstNameZh": "名",
    "nativeNameHintZh": "请使用汉字输入。",
    "nativeLastNameVi": "姓（越南文）",
    "nativeMiddleNameVi": "中间名（越南文）",
    "nativeFirstNameVi": "名（越南文）",
    "nativeNameHintVi": "姓 - 中间名 - 名（例如 Nguyễn Văn A）。",
    "motherTongue": "母语",
    "nativeName": "本地名",
    "nativeNameHint": "请用本地文字输入姓名（例如母语）。",
    "nativeNamePlaceholder": "用本地文字输入",
    "gender": "性别",
    "nationality": "国籍",
    "nationalityPlaceholder": "选择国家/地区",
    "dateOfBirth": "出生日期",
    "dateOfBirthHint": "格式：YYYY-MM-DD（例如 1990-01-15）。",
    "dateInputPlaceholder": "YYYY-MM-DD",
    "invalidFormat": "格式无效。请检查后重新输入。",
    "emergencyContactName": "紧急联系人姓名",
    "emergencyContactNamePlaceholder": "例如 Jane Doe",
    "emergencyContactPhone": "紧急联系人电话",
    "emergencyContactPhonePlaceholder": "例如 +65 9123 4567",
    "emergencyContactRelation": "与紧急联系人关系",
    "emergencyContactRelationPlaceholder": "例如 配偶",
    "personalMobile": "手机号码",
    "personalMobilePlaceholder": "例如 +65 9123 4567",
    "personalEmail": "个人邮箱",
    "personalEmailPlaceholder": "例如 you@gmail.com",
    "companyEmail": "公司邮箱",
    "companyEmailPlaceholder": "例如 you@company.com",
    "residenceCountry": "居住国",
    "residenceCountryPlaceholder": "例如 Singapore",
    "registeredAddress": "登记地址",
    "registeredAddressPlaceholder": "例如 123 Main St",
    "postalCode": "邮编",
    "postalCodeHint": "数字或字母数字（例如 123456 或 408600）。",
    "postalCodePlaceholder": "例如 123456",
    "visaType": "签证类型",
    "idNumber": "证件号 (NRIC/FIN)",
    "idNumberNotice": "NRIC/FIN 为薪资申报（IRAS/CPF）及签证有效性所必需。数据在传输中加密；输入时应用掩码以防泄露。",
    "idNumberHint": "新加坡 NRIC/FIN 格式（例如 S1234567D）。",
    "idNumberPlaceholder": "例如 S1234567D",
    "validity": "有效期",
    "validityHint": "签证或准证到期日。",
    "joiningDate": "入职日期",
    "joiningDateHint": "在公司首日上班日期。",
    "joiningDatePlaceholder": "例如 2025-03-01",
    "designation": "职位",
    "designationPlaceholder": "例如 Software Engineer",
    "department": "部门",
    "departmentPlaceholder": "例如 Engineering",
    "workType": "工作类型",
    "workTypeHint": "雇佣类型（例如新加坡 MOM）。",
    "workTypeOptions": {
      "Full-time": "全职",
      "Part-time": "兼职",
      "Contract": "合同制",
      "Temporary": "临时"
    },
    "reportsTo": "汇报对象",
    "reportsToPlaceholder": "例如 经理姓名",
    "leaveApprover": "请假审批人",
    "leaveApproverPlaceholder": "姓名或邮箱",
    "expenseApprover": "报销审批人",
    "expenseApproverPlaceholder": "姓名或邮箱",
    "attendanceApprover": "考勤审批人",
    "attendanceApproverPlaceholder": "姓名或邮箱",
    "paymentMethod": "支付方式",
    "bankName": "银行名称",
    "bankNameHint": "银行名称（例如 DBS、OCBC）。",
    "bankNamePlaceholder": "例如 DBS",
    "bankAccountNumber": "银行账号",
    "bankAccountNumberHint": "账号，仅数字或含连字符（例如 123-456-789）。",
    "bankAccountNumberPlaceholder": "例如 123-456-789",
    "contractedLeave": "合同年假 (天/年)",
    "contractedLeavePlaceholder": "例如 14",
    "usedLeave": "已用 (本年)",
    "usedLeaveHint": "已使用休假天数（例如 0）。",
    "usedLeavePlaceholder": "例如 0",
    "proRataPreview": "按比例假期预览",
    "proRataFormulaHint": "（在职月数 / 12）× 合同约定休假（新加坡 MOM）",
    "submitSuccess": "提交成功。",
    "magicLinkSent": "修改信息的链接已发送至您的邮箱。",
    "loadingSession": "加载中...",
    "submitting": "提交中...",
    "genderOptions": {
      "Male": "男",
      "Female": "女",
      "Other": "其他",
      "Prefer not to say": "不愿透露"
    },
    "visaTypes": {
      "Citizen": "公民",
      "PR": "永久居民",
      "EP": "就业准证",
      "S-Pass": "S Pass",
      "WP": "工作准证"
    },
    "paymentMethods": {
      "BankTransfer": "银行转账"
    },
    "editLinkLabel": "修改链接（保存此链接以便日后更新）",
    "copyLink": "复制链接",
    "copyLinkDone": "已复制！",
    "sessionExpiredAction": "填写新的入职表单",
    "consentText": "提交即表示您同意公司为入职、薪酬、人事及法律合规目的收集和使用您提供的信息，并遵守隐私政策及适用法律。",
    "consentAgree": "我同意",
    "printVersion": "打印"
  },
  "meta": {
    "productRepo": "core-platform",
    "sourcePath": "apps/employee-web/dictionaries/en.json#onboarding",
    "githubPath": "app/onboarding.page.json",
    "importedFrom": "apps/employee-web/dictionaries/zh.json#onboarding"
  }
}
