{
  "pageId": "app.notFound",
  "surface": "app",
  "route": "/{companyId}/{locale}/notFound",
  "version": 2,
  "sourceHash": "sha256:a0728b7f9ef9ccaffe23ac3f4841306bda7bf477b5414e2189898581960b9a00",
  "keys": {
    "title": "페이지를 찾을 수 없음",
    "description": "요청한 리소스를 찾을 수 없습니다",
    "returnHome": "홈으로 돌아가기"
  },
  "meta": {
    "productRepo": "core-platform",
    "sourcePath": "apps/employee-web/dictionaries/en.json#notFound",
    "githubPath": "app/notFound.page.json",
    "importedFrom": "apps/employee-web/dictionaries/ko.json#notFound"
  }
}
