{
  "pageId": "www.home",
  "surface": "www",
  "route": "/",
  "version": 3,
  "sourceHash": "sha256:4ec97d0261603fecf2ca5954c72dfc8fb526e0814bcc4f583e4397349bf90b06",
  "keys": {
    "path": "/",
    "meta_title": "Vouus | Mudah, terpadu ERP",
    "meta_description": "Satukan SDM, keuangan, dan operasi dalam satu platform alur kerja. Persetujuan, otomatisasi, dan pembukuan yang tetap sinkron—dibuat untuk tim yang sedang berkembang di APAC.",
    "hero_title": "Jalankan bisnis Anda dalam satu aliran",
    "hero_description": "Satu platform untuk orang, uang, dan persetujuan—tanpa spreadsheet atau pekerjaan kursi putar.",
    "pillars_0_title": "Connected",
    "pillars_0_description": "SDM, keuangan, dan operasi dalam satu catatan.",
    "pillars_1_title": "Automated",
    "pillars_1_description": "Persetujuan dan tugas tanpa pengejaran.",
    "pillars_2_title": "Defensible",
    "pillars_2_description": "Jalur audit dan kepatuhan regional sudah ada di dalamnya.",
    "proof_0": "Uji coba 14 hari, tanpa kartu kredit",
    "proof_1": "Tayangkan dalam ~2 minggu",
    "proof_2": "eFaktur siap pakai",
    "proof_3": "Penangkapan dan persetujuan seluler",
    "proof_4": "Skala 5 hingga 500+ pengguna",
    "proof_5": "Dibangun di Singapura untuk Asia Tenggara",
    "problem_title": "Masalahnya",
    "problem_subtitle": "When work stalls, teams pay the cost.",
    "problem_0_title": "Persetujuan terjebak dalam obrolan",
    "problem_0_tagline": "Serah terima terhenti ketika status ada di DM.",
    "problem_1_title": "Perburuan pemulung akhir bulan",
    "problem_1_tagline": "Keuangan mengejar tanda terima di seluruh alat dan file.",
    "problem_2_title": "Keputusan tanpa bukti",
    "problem_2_tagline": "Pemimpin bertindak berdasarkan data basi tanpa jejak audit.",
    "features_title": "Modul produk",
    "features_subtitle": "Satu tulang punggung tentang bagaimana pekerjaan berjalan.",
    "modules_0_title": "SDM & Kehadiran",
    "modules_0_tagline": "Check-in ke penggajian pada satu jalur persetujuan.",
    "modules_1_title": "Manajemen Biaya",
    "modules_1_tagline": "Tangkap dan setujui tanpa kejar-kejaran.",
    "modules_2_title": "eInvoice & Accounting",
    "modules_2_tagline": "Faktur ke buku besar—tidak perlu masuk kembali.",
    "modules_3_title": "Workflow Builder",
    "modules_3_tagline": "Publikasikan persetujuan yang dapat dipertahankan oleh tim Anda.",
    "modules_view_all": "Lihat semua modul",
    "learn_more": "Pelajari lebih lanjut",
    "stats_0_value": "80%",
    "stats_0_label": "Lebih sedikit pekerjaan manual",
    "stats_1_value": "3×",
    "stats_1_label": "Lebih cepat menutup",
    "stats_2_value": "hari 1",
    "stats_2_label": "Siap untuk berlari",
    "stats_context": "Tim melaporkan lebih sedikit pekerjaan manual dan penyelesaian bulan yang lebih cepat setelah peralihan.",
    "testimonial_title": "Bangun otomatisasi pada alur kerja nyata",
    "testimonial_quote": "Akhir bulan biasanya memakan waktu tiga hari untuk mengejar data. Kini tinggal peninjauan satu hari—bagian alur kerja menangani apa yang dulunya merupakan penyerahan manual.",
    "testimonial_author_line": "Sarah Lim, CFO di NovaTech Solutions",
    "testimonial_footnote": "Bergabunglah dengan tim di Singapura dan Asia Tenggara.",
    "pricing_headline": "Rencanakan sesuai skala Anda",
    "pricing_subline": "Mulailah dari yang kecil. Tambahkan otomatisasi seiring pertumbuhan Anda.",
    "pricing_cta": "Lihat harga",
    "support_title": "Siap untuk memulai?",
    "support_subtitle": "Bicaralah dengan tim kami, lihat demo langsung, atau mulai uji coba gratis Anda hari ini.",
    "support_0_title": "Pesan demo langsung",
    "support_0_description": "Lihat platform beraksi dengan panduan yang dipersonalisasi.",
    "support_0_cta": "Pesan demo",
    "support_1_title": "Mulai secara gratis",
    "support_1_description": "Uji coba Pro 14 hari, memerlukan email kantor, tanpa kartu kredit.",
    "support_1_cta": "Mulai uji coba gratis",
    "support_2_title": "Bicaralah dengan penjualan",
    "support_2_description": "Diskusikan harga, migrasi, atau persyaratan perusahaan.",
    "support_2_cta": "Hubungi Penjualan",
    "faq_title": "FAQ",
    "faq_more_docs": "Pertanyaan lebih lanjut ada di dokumen →",
    "faq_0_q": "Apa saja yang termasuk dalam langganan platform?",
    "faq_0_a": "Anda dapat naik ke tier yang lebih tinggi untuk menambah pengguna, kapasitas, dan tingkat dukungan. Kami akan membantu memilih paket yang tepat seiring pertumbuhan penggunaan dan tim.",
    "faq_1_q": "Apakah ada batas pengguna atau sistem?",
    "faq_1_a": "Setiap paket memiliki batas pengguna, tetapi penggunaan sistem (compute/penyimpanan) dapat diskalakan, dan kami menawarkan opsi pay-as-you-go untuk mendukung pertumbuhan.",
    "faq_2_q": "Bisakah kami mulai kecil lalu berkembang?",
    "faq_2_a": "Ya. Banyak tim memulai dengan tier kecil dan naik seiring menambah pengguna dan workflow.",
    "faq_3_q": "Untuk siapa paket Enterprise paling cocok?",
    "faq_3_a": "Dirancang untuk organisasi besar yang membutuhkan instance khusus, deployment on-premise, atau mandat keamanan ketat yang memerlukan lingkungan terisolasi.",
    "faq_4_q": "Metode pembayaran apa yang diterima?",
    "faq_4_a": "Kami menerima kartu kredit utama, transfer bank, dan penagihan invoice untuk paket tahunan. Hubungi kami untuk opsi pembayaran enterprise.",
    "hero_cta_primary": "Mulai uji coba gratis",
    "hero_cta_secondary": "Lihat dalam 15 menit",
    "faq_5_q": "Bisakah kami ganti paket di tengah siklus?",
    "faq_5_a": "Ya. Upgrade berlaku segera; downgrade berlaku periode penagihan berikutnya. Kredit prorata mungkin berlaku.",
    "faq_6_q": "Apakah ada uji coba gratis?",
    "faq_6_a": "Ya. Uji coba gratis 14 hari dengan akses Pro penuh—verifikasi email kerja dan mulai onboarding di hari yang sama. Tanpa kartu kredit.",
    "faq_7_q": "Apa yang terjadi jika melebihi batas pengguna?",
    "faq_7_a": "Anda dapat upgrade ke tier lebih tinggi atau menambah pengguna via pay-as-you-go. Kami akan memberi tahu sebelum biaya kelebihan diterapkan.",
    "faq_8_q": "Apakah ada diskon tahunan?",
    "faq_8_a": "Ya. Penagihan tahunan diskon 10% dibanding bulanan.",
    "faq_9_q": "Apa maksud workflow automation?",
    "faq_9_a": "Kemampuan menjalankan langkah bisnis berulang—notifikasi, routing, jendela payroll, pengiriman invoice—sesuai aturan yang Anda tentukan, dengan riwayat lengkap alih-alih klik manual sekali."
  },
  "meta": {
    "productRepo": "web-public",
    "sourcePath": "apps/marketing-web/lib/home-section-content.ts",
    "githubPath": "www/home.page.json",
    "translationStatus": "ai_draft",
    "method": "cursor-ai"
  }
}
