{
  "pageId": "www.terms",
  "surface": "www",
  "route": "/terms",
  "version": 1,
  "sourceHash": "sha256:d76c194b6d1d60d3f3f503ecdfd4db6678278d2800bf3bfbb806bb8d01b5141a",
  "keys": {
    "path": "/terms",
    "meta_title": "서비스 이용약관",
    "meta_description": "서비스 이용약관.",
    "page_title": "서비스 이용약관",
    "page_subtitle": "{brand} 플랫폼 서비스 이용약관",
    "s01_title": "1. 소개",
    "s01_p0": "본 서비스 이용약관(\"약관\")은 싱가포르 법인 iPrego Pte. Ltd.가 제공하는 {brand} 플랫폼 및 관련 서비스의 접근 및 이용을 규정합니다.",
    "s01_p1": "{brand} 플랫폼에 접근하거나 이용하면 본 약관에 동의하는 것으로 간주됩니다.",
    "s01_p2": "본 약관에 동의하지 않으면 서비스를 이용할 수 없습니다.",
    "s02_title": "2. 서비스 소개",
    "s03_title": "3. 이용 자격",
    "s04_title": "4. 사용자 계정",
    "s05_title": "5. 허용 가능한 이용",
    "s06_title": "6. 고객 데이터",
    "s07_title": "7. 보조 및 자동화 기능",
    "s08_title": "8. 요금 및 구독",
    "s09_title": "9. 서비스 가용성",
    "s10_title": "10. 지적 재산권",
    "s11_title": "11. 해지",
    "s12_title": "12. 책임의 한계",
    "s13_title": "13. 준거법",
    "s14_title": "14. 업데이트",
    "s02_p0": "{brand}는 다음을 포함하는 통합 비즈니스 소프트웨어 솔루션을 제공하는 클라우드 기반 SaaS 플랫폼입니다.",
    "s02_ul1_li0": "전사적 자원 관리(ERP)",
    "s02_ul1_li1": "회계 및 재무 자동화",
    "s02_ul1_li2": "인적 자원 관리",
    "s02_ul1_li3": "고객 관계 관리(CRM)",
    "s02_ul1_li4": "비즈니스 분석 및 보고",
    "s02_ul1_li5": "워크플로 자동화",
    "s02_p2": "서비스는 iPrego Pte. Ltd.가 운영하는 웹 기반 애플리케이션을 통해 제공됩니다.",
    "s03_p0": "{brand} 플랫폼을 이용하려면 만 18세 이상이며 구속력 있는 계약을 체결할 법적 능력이 있어야 합니다.",
    "s03_p1": "조직을 대표하여 서비스를 이용하는 경우, 해당 조직을 본 약관에 구속할 권한이 있음을 확인합니다.",
    "s04_p0": "일부 서비스에 접근하려면 계정을 생성해야 합니다.",
    "s04_p1": "귀하는 다음에 동의합니다.",
    "s04_ul2_li0": "정확한 정보 제공",
    "s04_ul2_li1": "로그인 자격 증명의 기밀 유지",
    "s04_ul2_li2": "계정의 무단 사용을 즉시 당사에 통지(연락처: {support_email})",
    "s04_p3": "사용자는 본인 계정을 통해 수행되는 모든 활동에 대한 책임을 집니다.",
    "s05_p0": "사용자는 다음과 같은 방식으로 플랫폼을 이용해서는 안 됩니다.",
    "s05_ul1_li0": "적용 법률 또는 규정 위반",
    "s05_ul1_li1": "지적 재산권 침해",
    "s05_ul1_li2": "시스템에 대한 무단 접근 시도",
    "s05_ul1_li3": "플랫폼의 보안 또는 성능 방해",
    "s05_ul1_li4": "악성 소프트웨어 배포",
    "s05_p2": "iPrego Pte. Ltd.는 서비스 오용 시 계정을 정지하거나 해지할 권리를 보유합니다.",
    "s06_p0": "고객은 플랫폼에 업로드한 모든 데이터의 소유권을 보유합니다.",
    "s06_p1": "iPrego Pte. Ltd.는 고객을 대신하여 개인정보를 처리할 때 싱가포르 PDPA에 따른 데이터 중개자 역할을 합니다.",
    "s06_p2": "당사는 플랫폼 서비스 제공 목적으로만 해당 데이터를 처리합니다.",
    "s06_p3": "고객은 자신의 데이터 수집 및 이용이 적용 법률을 준수하도록 할 책임이 있습니다.",
    "s07_p0": "{brand} 플랫폼에는 비즈니스 운영을 지원하기 위한 보조 및 자동화 기능이 포함될 수 있습니다.",
    "s07_p1": "시스템 생성 결과물은:",
    "s07_ul2_li0": "정보 제공 목적으로만 제공됩니다",
    "s07_ul2_li1": "사용자 확인이 필요할 수 있습니다",
    "s07_ul2_li2": "전문적 조언으로 의존해서는 안 됩니다",
    "s07_p3": "사용자는 자동화 또는 제안된 결정을 실행하기 전에 검토할 책임이 있습니다.",
    "s08_p0": "플랫폼의 일부 기능은 유료 구독이 필요합니다.",
    "s08_p1": "고객은 다음에 동의합니다.",
    "s08_ul2_li0": "해당 구독 요금 납부",
    "s08_ul2_li1": "유효한 결제 정보 유지",
    "s08_ul2_li2": "결제 조건 준수",
    "s08_p3": "갱신일 이전에 취소하지 않으면 구독이 자동으로 갱신될 수 있습니다.",
    "s09_p0": "iPrego Pte. Ltd.는 안정적인 서비스 가용성을 제공하기 위해 노력합니다.",
    "s09_p1": "다만 다음으로 인해 서비스 중단이 발생할 수 있습니다.",
    "s09_ul2_li0": "시스템 유지보수",
    "s09_ul2_li1": "인프라 업데이트",
    "s09_ul2_li2": "예기치 못한 기술적 문제",
    "s09_p3": "서비스 복구를 위해 합리적인 노력을 기울입니다.",
    "s10_p0": "{brand} 플랫폼의 소프트웨어, 디자인, 콘텐츠를 포함한 모든 권리는 iPrego Pte. Ltd. 또는 해당 라이선스 제공자에게 있습니다.",
    "s10_p1": "사용자에게는 플랫폼에 접근하고 이용할 수 있는 제한적, 비독점적, 양도 불가능한 라이선스가 부여됩니다.",
    "s10_p2": "사용자는 승인 없이 플랫폼을 복사, 수정, 배포 또는 리버스 엔지니어링할 수 없습니다.",
    "s11_p0": "사용자가 본 약관을 위반하는 경우 접근을 정지하거나 해지할 수 있습니다.",
    "s11_p1": "사용자는 언제든지 계정을 해지할 수 있습니다.",
    "s11_p2": "해지 시:",
    "s11_ul3_li0": "플랫폼 접근이 중단될 수 있습니다",
    "s11_ul3_li1": "저장된 데이터는 보존 정책에 따라 삭제될 수 있습니다",
    "s12_p0": "법률이 허용하는 최대 범위 내에서 iPrego Pte. Ltd.는 다음에 대해 책임을 지지 않습니다.",
    "s12_ul1_li0": "간접적 또는 결과적 손해",
    "s12_ul1_li1": "이익 또는 수익 손실",
    "s12_ul1_li2": "사업 중단",
    "s12_ul1_li3": "사용자 행위로 인한 데이터 손실",
    "s13_p0": "본 약관은 싱가포르 법률의 적용을 받습니다.",
    "s13_p1": "모든 분쟁은 싱가포르 법원의 전속 관할에 따릅니다.",
    "s14_p0": "당사는 본 약관을 수시로 업데이트할 수 있습니다.",
    "s14_p1": "업데이트 후 플랫폼을 계속 이용하면 개정된 약관에 동의한 것으로 간주됩니다."
  },
  "meta": {
    "productRepo": "infra-control-plane",
    "sourcePath": "src/marketing-pages/registry.ts terms",
    "githubPath": "www/terms.page.json",
    "translationStatus": "reviewed",
    "method": "patch-legal-full-body"
  }
}
