{
  "pageId": "www.solutions_use-cases",
  "surface": "www",
  "route": "/solutions/use-cases",
  "version": 1,
  "sourceHash": "sha256:726a70be7e73bea6ddf600a80b83b2a5ab31d53903f3c7a7bab68dc68575e97e",
  "keys": {
    "path": "/solutions/use-cases",
    "meta_title": "Use Cases",
    "meta_description": "Industry patterns for HR, finance, and operations—Attendance, Leave, Expense, eInvoice, and Approval in one flow.",
    "hero_title": "Use cases on real workflows",
    "hero_description": "Industry patterns on one canvas.",
    "features_0_title": "Industries",
    "features_0_description": "Retail, services, manufacturing, and professional firms.",
    "features_1_title": "Patterns",
    "features_1_description": "Month-end, payroll, and billing playbooks.",
    "features_2_title": "Proof",
    "features_2_description": "Operations, finance, and people in one story.",
    "sections_0_headline": "Generic decks",
    "sections_0_body": "Stories skip approvals and cutoffs buyers care about.",
    "sections_1_headline": "Sector templates",
    "sections_1_body": "Same core modules anchored to your floor.",
    "sections_2_headline": "Timed automation",
    "sections_2_body": "Billing cycles and payroll windows built in.",
    "sections_3_headline": "Shorter pilots",
    "sections_3_body": "Narrative matches how teams already run.",
    "faq_0_q": "Which industries is the platform best suited for?",
    "faq_0_a": "Professional services, retail, manufacturing, logistics, and healthcare teams all use the platform. The workflow layer adapts to how each sector approves, bills, and closes.",
    "faq_1_q": "Can I see how the platform handles payroll in my industry?",
    "faq_1_a": "Yes. Book a demo and we will walk through a payroll cycle, expense close, or billing workflow tailored to your sector.",
    "faq_2_q": "How long is a typical pilot?",
    "faq_2_a": "Most teams complete a pilot in two to four weeks—long enough to run a full payroll cycle and an expense close with real data.",
    "faq_3_q": "Can we start small and expand?",
    "faq_3_a": "Yes. Turn on modules as you grow—HR, finance, analytics, and workflow blocks scale together.",
    "faq_4_q": "Where can I compare plans?",
    "faq_4_a": "Use the Pricing page for tiers; Enterprise adds SLA, scale, and governance options.",
    "faq_5_q": "How do I get a demo?",
    "faq_5_a": "Use Talk to sales or Book demo from the header—our team can align Automation and Scheduler to your process.",
    "faq_6_q": "Common question 7",
    "faq_6_a": "Contact our team for a walkthrough tailored to your workflow.",
    "faq_7_q": "Common question 8",
    "faq_7_a": "Contact our team for a walkthrough tailored to your workflow.",
    "cta_title": "Your business, evolved",
    "cta_description": "Explore pricing or talk to sales."
  },
  "meta": {
    "productRepo": "infra-control-plane",
    "sourcePath": "src/marketing-pages/registry.ts solutions/use-cases",
    "githubPath": "www/solutions_use-cases.page.json",
    "translationStatus": "ai_draft",
    "method": "cursor-ai"
  }
}
