{
  "pageId": "account.integrations.xero_migration",
  "surface": "account",
  "route": "/integrations/xero/migration/:jobId",
  "version": 2,
  "sourceHash": "sha256:e5d0a09bc79903ffa6cac6a7649f587b37fac15649ff280b41d2ccc5d58e69ab",
  "keys": {
    "title": "งานย้ายข้อมูล Xero",
    "subtitleLoading": "กำลังโหลดสถานะงาน…",
    "jobIdPrefix": "Job",
    "statusLabel": "Status",
    "modeLabel": "Mode",
    "targetErpLabel": "Target ERP",
    "entitiesExtractedTitle": "Entities extracted",
    "validationLabel": "Validation — L1 errors: {l1}, L2 warnings: {l2}",
    "attachmentLoadLabel": "Attachment upload — uploaded: {uploaded}, skipped: {skipped}, errors: {errors}",
    "reconcilePassed": "L3 trial balance reconcile: passed",
    "reconcileNeedsReview": "L3 trial balance reconcile: needs review",
    "reconcileAccountsSuffix": "{count} accounts",
    "reconcileOutOfTolerance": "{count} out of tolerance",
    "columnAccount": "Account",
    "columnXero": "Xero",
    "columnErp": "ERP",
    "columnDelta": "Delta",
    "columnReasons": "Reasons",
    "agingReconcileTitle": "AR/AP aging reconcile",
    "agingPassed": "passed",
    "agingNeedsReview": "needs review",
    "agingSkipped": "Skipped ({reason})",
    "agingCompare": "Xero {source} vs ERP {target} (delta {delta})",
    "rawSummaryLabel": "Raw summary JSON",
    "jobNotAvailable": "Job not available.",
    "loadFailed": "Load failed"
  },
  "meta": {
    "productRepo": "core-platform",
    "sourcePath": "apps/admin-web /integrations/xero/migration/:jobId",
    "githubPath": "account/integrations.xero_migration.page.json",
    "translationStatus": "review",
    "method": "cursor-ai-2",
    "reviewedAt": "2026-06-30"
  }
}
