{
  "pageId": "app.auth",
  "surface": "app",
  "route": "/{companyId}/{locale}/auth",
  "version": 3,
  "sourceHash": "sha256:8b34666b91cb36945a71a8682b109ba0006103c6838d504dbd36539deaf3d4e6",
  "keys": {
    "verifyEmailTitle": "ඔබගේ විද්‍යුත් තැපෑලට යවන ලද ඉලක්කම් 6ක සත්‍යාපන කේතය ඇතුලත් කරන්න",
    "sendCode": "සත්‍යාපන කේතය යවන්න",
    "sendCodePrompt": "ඔබගේ විද්‍යුත් තැපෑලට සත්‍යාපන කේතයක් යවන්න",
    "sending": "යවමින්...",
    "lockedMinutes": "බොහෝ අසාර්ථක උත්සාහයන්. කරුණාකර විනාඩි 5කින් නැවත උත්සාහ කරන්න.",
    "remainingAttempts": "ඉතිරි උත්සාහයන්",
    "invalidPasscode": "වලංගු නොවන මුර කේතය",
    "resendCode": "කේතය නැවත යවන්න",
    "resendCodeCooldown": "{seconds}s හි නැවත යවන්න",
    "resendCodeSuccess": "නව කේතයක් එවා ඇත.",
    "resendCodeFailed": "කේතය නැවත යැවීමට නොහැකි විය. නැවත උත්සාහ කරන්න.",
    "verifyEmailSentTo": "අපි {email} වෙත කේතයක් යැව්වෙමු",
    "verifyEmailSpamHint": "අයාචිත තැපෑල හෝ කසළ පරීක්ෂා කරන්න. ආයතනික ඊමේල් පෙරහන් මිනිත්තු කිහිපයකින් බෙදා හැරීම ප්‍රමාද කළ හැක.",
    "useDifferentEmail": "වෙනස් විද්‍යුත් තැපෑලක් භාවිතා කරන්න",
    "otpEmailNotConfigured": "සත්‍යාපන ඊමේල් නොමැත. කරුණාකර ඔබේ පරිපාලක අමතන්න.",
    "otpEmailSendFailed": "අපට සත්‍යාපන විද්‍යුත් තැපෑල යැවීමට නොහැකි විය. අයාචිත තැපෑල පරීක්ෂා කරන්න හෝ මොහොතකින් නැවත උත්සාහ කරන්න.",
    "otpUserNotFound": "මෙම විද්‍යුත් තැපෑල සඳහා සේවක ගිණුමක් හමු නොවීය.",
    "tryDemo": "demo උත්සාහ කරන්න",
    "emailLabel": "ඊමේල් කරන්න",
    "emailRequired": "විද්‍යුත් තැපෑල අවශ්‍යයි",
    "passwordLabel": "මුරපදය",
    "signInWithPassword": "ඔබගේ විද්‍යුත් තැපෑල සහ මුරපදය සමඟ පුරන්න",
    "signInWithPasswordInstead": "ඒ වෙනුවට මුරපදය සමඟ පුරන්න",
    "useVerificationCode": "ඒ වෙනුවට සත්‍යාපන කේතය භාවිතා කරන්න",
    "activate": {
      "tokenMissing": "සක්‍රිය කිරීමේ ටෝකනයක් හමු නොවීය. කරුණාකර ඔබගේ ආරාධනා විද්‍යුත් තැපෑල පරීක්ෂා කරන්න.",
      "tokenExpired": "මෙම සක්‍රිය කිරීමේ සබැඳිය කල් ඉකුත් වී ඇත. ආරාධනා විද්‍යුත් තැපෑල නැවත යැවීමට ඔබේ පරිපාලකගෙන් ඉල්ලා සිටින්න.",
      "tokenInvalid": "මෙම සක්‍රීය කිරීමේ සබැඳිය වලංගු නොවේ හෝ දැනටමත් භාවිතා කර ඇත.",
      "tokenAlreadyUsed": "මෙම සක්‍රිය කිරීමේ සබැඳිය දැනටමත් භාවිතා කර ඇත. ඔබගේ මුරපදය සමඟ පුරන්න.",
      "networkError": "ජාල දෝෂයකි. කරුණාකර නැවත උත්සාහ කරන්න.",
      "passwordsDoNotMatch": "මුරපද නොගැලපේ.",
      "invalidPassword": "වලංගු නොවන මුරපදයක්.",
      "setPasswordFailed": "ඔබගේ මුරපදය සැකසීමට නොහැකි විය. කරුණාකර නැවත උත්සාහ කරන්න.",
      "goToSignIn": "පුරනය වීමට යන්න",
      "successTitle": "මුරපදය සාර්ථකව සකසා ඇත",
      "successDescription": "ඔබට දැන් ඔබගේ විද්‍යුත් තැපෑල සහ නව මුරපදය භාවිතයෙන් පුරනය විය හැක.",
      "successDescriptionWithCompany": "ඔබට දැන් ඔබගේ විද්‍යුත් තැපෑල සහ නව මුරපදය භාවිතයෙන්  0  වෙත පුරනය විය හැක.",
      "signIn": "පුරන්න",
      "settingUpAccess": "0  වෙත ඔබේ ප්‍රවේශය සැකසීම",
      "title": "ඔබගේ මුරපදය සකසන්න",
      "welcomeWithName": "සාදරයෙන් පිළිගනිමු, {displayName}. ඔබගේ ගිණුම් පිහිටුවීම සම්පූර්ණ කිරීමට මුරපදයක් තෝරන්න.",
      "choosePassword": "ඔබගේ ගිණුම් පිහිටුවීම සම්පූර්ණ කිරීමට මුරපදයක් තෝරන්න.",
      "accountLabel": "ගිණුම:",
      "passwordLabel": "මුරපදය",
      "confirmPasswordLabel": "මුරපදය තහවුරු කරන්න",
      "passwordPlaceholder": "අඩුම තරමින්  0  අක්ෂර",
      "confirmPasswordPlaceholder": "ඔබගේ මුරපදය නැවත කරන්න",
      "settingPassword": "මුරපදය සකසමින්...",
      "submitButton": "මුරපදය සකසා සක්රිය කරන්න",
      "alreadyHavePassword": "දැනටමත් මුරපදයක් තිබේද?",
      "signInLink": "පුරන්න"
    },
    "changeWorkPassword": {
      "sessionExpiredNoToken": "ඔබගේ පුරනය වීමේ සැසිය කල් ඉකුත් විය. ඔබගේ තාවකාලික මුරපදය සමඟ නැවත පුරන්න.",
      "sessionExpiredInvalid": "ඔබගේ පුරනය වීමේ සැසිය කල් ඉකුත් වී හෝ වලංගු නොවේ. ඔබගේ තාවකාලික මුරපදය සමඟ නැවත පුරන්න.",
      "networkError": "ජාල දෝෂයකි. කරුණාකර නැවත උත්සාහ කරන්න.",
      "sameAsTemporary": "ඔබගේ තාවකාලික මුරපදයට වඩා වෙනස් නව මුරපදයක් තෝරන්න.",
      "saveFailed": "ඔබගේ නව මුරපදය සුරැකීමට නොහැකි විය. කරුණාකර නැවත උත්සාහ කරන්න.",
      "deskSyncFailed": "ඔබගේ Work App මුරපදය යාවත්කාලීන කරන ලදී, නමුත් Work Desk සමමුහුර්ත කිරීම අසාර්ථක විය. කරුණාකර නැවත උත්සාහ කරන්න හෝ ඔබේ පරිපාලක අමතන්න.",
      "deskSyncDetailLabel": "විස්තර",
      "retryDeskSyncButton": "0 සමමුහුර්ත කිරීමට නැවත උත්සාහ කරන්න",
      "retryingDeskSync": "0 සමමුහුර්ත කිරීමට නැවත උත්සාහ කරමින්...",
      "goToSignIn": "පුරනය වීමට යන්න",
      "title": "ඔබගේ කාර්යාල මුරපදය සකසන්න",
      "description": "Work App සහ Work Desk සඳහා භාවිත කර ඇත — account.vouus.com හි ඔබගේ ගිණුම් ද්වාර මුරපදය නොවේ.",
      "accountLabel": "ගිණුම:",
      "newPasswordLabel": "නව මුරපදය",
      "confirmPasswordLabel": "මුරපදය තහවුරු කරන්න",
      "passwordPlaceholder": "අඩුම තරමින්  0  අක්ෂර",
      "confirmPasswordPlaceholder": "ඔබගේ මුරපදය නැවත කරන්න",
      "passwordsDoNotMatch": "මුරපද නොගැලපේ",
      "saving": "මුරපදය සුරකිමින්...",
      "submitButton": "මුරපදය සුරකින්න සහ ඉදිරියට යන්න",
      "needHelp": "උදව් අවශ්‍යද?",
      "returnToSignIn": "පුරනය වීමට ආපසු යන්න"
    }
  },
  "meta": {
    "productRepo": "core-platform",
    "sourcePath": "apps/employee-web/dictionaries/en.json#auth",
    "githubPath": "app/auth.page.json",
    "importedFrom": "apps/employee-web/dictionaries/si.json#auth"
  }
}
