{
  "pageId": "app.signup",
  "surface": "app",
  "route": "/{companyId}/{locale}/signup",
  "version": 3,
  "sourceHash": "sha256:ddb5417f701bc66105f54e1db3bac33ffdab5057c480dd09cf5f531e7b0ea8d2",
  "keys": {
    "brandName": "Pregoi",
    "title": "Зарегистрироваться",
    "firstNameLabel": "Имя",
    "firstNamePlaceholder": "Введите свое имя",
    "emailLabel": "Электронная почта",
    "emailPlaceholder": "johndoe@gmail.com",
    "passwordLabel": "Пароль",
    "passwordPlaceholder": "Используйте надежный пароль",
    "confirmPasswordLabel": "Подтвердите пароль",
    "confirmPasswordPlaceholder": "Повторно введите свой пароль",
    "submitButton": "Зарегистрироваться",
    "alreadyHaveAccount": "У вас уже есть аккаунт?",
    "logIn": "Авторизоваться",
    "errorPasswordsDoNotMatch": "Пароли не совпадают",
    "errorGeneric": "Что-то пошло не так. Пожалуйста, попробуйте еще раз.",
    "signingUp": "Создание аккаунта…"
  },
  "meta": {
    "productRepo": "core-platform",
    "sourcePath": "apps/employee-web/dictionaries/en.json#signup",
    "githubPath": "app/signup.page.json",
    "importedFrom": "apps/employee-web/dictionaries/ru.json#signup"
  }
}
