{
  "pageId": "account.shell.profile",
  "surface": "account",
  "route": "/profile",
  "version": 1,
  "sourceHash": "sha256:119605f707e26aec0a235727e9b890fd6bab9389e15d1200a6645d79415bad0f",
  "keys": {
    "title": "个人资料",
    "subtitle": "您的账户和组织详情。"
  },
  "meta": {
    "productRepo": "core-platform",
    "sourcePath": "apps/admin-web /profile",
    "githubPath": "account/shell.profile.page.json",
    "translationStatus": "reviewed",
    "method": "cursor-ai"
  }
}
