{
  "pageId": "account.auth.forgotPassword",
  "surface": "account",
  "route": "/login",
  "version": 1,
  "sourceHash": "sha256:0000000000000000000000000000000000000000000000000000000000000003",
  "keys": {
    "title": "Reset your service administrator password",
    "intro": "Enter the email for your admin account. If it is registered, we will send a link to set a new service administrator password (for subscription, billing, and user management — separate from your Work Desk and Work App password).",
    "emailLabel": "Email",
    "sendResetLink": "Send reset link",
    "sending": "Sending…",
    "cancel": "Cancel",
    "successMessage": "If an account exists for that email, we sent a reset link. Check your inbox.",
    "primaryOk": "OK"
  },
  "meta": {
    "productRepo": "core-platform",
    "sourcePath": "apps/admin-web /login",
    "githubPath": "account/auth.forgotPassword.page.json"
  }
}
