{
  "pageId": "app.auth",
  "surface": "app",
  "route": "/{companyId}/{locale}/auth",
  "version": 2,
  "sourceHash": "sha256:f140abf9a18009377b1a7ecbdd117f697e460d7d926a1476123de2dcc57f48ca",
  "keys": {
    "verifyEmailTitle": "请输入发送到您邮箱的6位验证码",
    "sendCode": "发送验证码",
    "sendCodePrompt": "向您的邮箱发送验证码",
    "sending": "发送中...",
    "lockedMinutes": "尝试次数过多，请5分钟后再试。",
    "remainingAttempts": "剩余次数",
    "invalidPasscode": "密码错误",
    "resendCode": "重新发送",
    "resendCodeCooldown": "{seconds} 秒后可重新发送",
    "resendCodeSuccess": "已发送新的验证码。",
    "resendCodeFailed": "无法重新发送验证码。请重试。",
    "verifyEmailSentTo": "我们已向 {email} 发送验证码",
    "verifyEmailSpamHint": "请检查垃圾邮件文件夹。企业邮件过滤器可能会延迟几分钟。",
    "useDifferentEmail": "使用其他邮箱",
    "otpEmailNotConfigured": "无法发送验证邮件。请联系管理员。",
    "otpEmailSendFailed": "无法发送验证邮件。请检查垃圾邮件或稍后再试。",
    "otpUserNotFound": "未找到该邮箱对应的员工账户。",
    "tryDemo": "试用演示",
    "emailLabel": "邮箱",
    "emailRequired": "请输入邮箱",
    "passwordLabel": "密码",
    "signInWithPassword": "使用邮箱和密码登录",
    "signInWithPasswordInstead": "使用密码登录",
    "useVerificationCode": "改用验证码登录"
  },
  "meta": {
    "productRepo": "core-platform",
    "sourcePath": "apps/employee-web/dictionaries/en.json#auth",
    "githubPath": "app/auth.page.json",
    "importedFrom": "apps/employee-web/dictionaries/zh.json#auth",
    "translationStatus": "reviewed",
    "method": "cursor-ai"
  }
}
