{
  "pageId": "www.privacy",
  "surface": "www",
  "route": "/privacy",
  "version": 1,
  "sourceHash": "sha256:eeafcb17880ccbaf371f25f5fcba2fd519a887eb51f5ebdf8cb6f9402c8d4deb",
  "keys": {
    "path": "/privacy",
    "meta_title": "Политика конфиденциальности",
    "meta_description": "Политика конфиденциальности и соответствие PDPA."
  },
  "meta": {
    "productRepo": "infra-control-plane",
    "sourcePath": "src/marketing-pages/registry.ts privacy",
    "githubPath": "www/privacy.page.json",
    "translationStatus": "ai_draft",
    "method": "cursor-ai"
  }
}
