{
  "pageId": "account.shell.dashboard",
  "surface": "account",
  "route": "/dashboard",
  "version": 1,
  "sourceHash": "sha256:e6f240877e65ee243353d0fb18280c2145b45bf9a9193ad0ae86381b5259e86f",
  "keys": {
    "title": "Dashboard",
    "subtitle": "Overview of your account and services",
    "subtitleSignedIn": "Welcome, {name} — manage your subscription, portals, and usage."
  },
  "meta": {
    "productRepo": "core-platform",
    "sourcePath": "apps/admin-web /dashboard",
    "githubPath": "account/shell.dashboard.page.json"
  }
}
