{
  "pageId": "app.auth",
  "surface": "app",
  "route": "/{companyId}/{locale}/auth",
  "version": 3,
  "sourceHash": "sha256:8b34666b91cb36945a71a8682b109ba0006103c6838d504dbd36539deaf3d4e6",
  "keys": {
    "verifyEmailTitle": "Введите 6-значный код подтверждения, отправленный на вашу электронную почту",
    "sendCode": "Отправить код подтверждения",
    "sendCodePrompt": "Отправьте код подтверждения на вашу электронную почту",
    "sending": "Отправка…",
    "lockedMinutes": "Слишком много неудачных попыток. Пожалуйста, повторите попытку через 5 минут.",
    "remainingAttempts": "Оставшиеся попытки",
    "invalidPasscode": "Неверный код доступа",
    "resendCode": "Отправить код повторно",
    "resendCodeCooldown": "Повторная отправка доступна через {seconds} с.",
    "resendCodeSuccess": "Новый код отправлен.",
    "resendCodeFailed": "Не удалось отправить код повторно. Попробуйте снова.",
    "verifyEmailSentTo": "Мы отправили код на номер {email}",
    "verifyEmailSpamHint": "Проверьте папку «Спам». Корпоративные фильтры могут задержать доставку на несколько минут.",
    "useDifferentEmail": "Используйте другой адрес электронной почты",
    "otpEmailNotConfigured": "Электронная почта для подтверждения недоступна. Пожалуйста, свяжитесь с вашим администратором.",
    "otpEmailSendFailed": "Нам не удалось отправить письмо с подтверждением. Проверьте спам или повторите попытку через минуту.",
    "otpUserNotFound": "Учётная запись сотрудника с этим адресом не найдена.",
    "tryDemo": "Попробуйте демо",
    "emailLabel": "Электронная почта",
    "emailRequired": "Укажите адрес электронной почты",
    "passwordLabel": "Пароль",
    "signInWithPassword": "Войдите, используя свой адрес электронной почты и пароль",
    "signInWithPasswordInstead": "Вместо этого войдите с паролем",
    "useVerificationCode": "Вместо этого используйте код подтверждения",
    "activate": {
      "tokenMissing": "Токен активации не найден. Проверьте письмо с приглашением.",
      "tokenExpired": "Срок действия ссылки активации истёк. Попросите администратора повторно отправить приглашение.",
      "tokenInvalid": "Ссылка активации недействительна или уже использована.",
      "tokenAlreadyUsed": "Ссылка активации уже использована. Войдите с паролем.",
      "networkError": "Ошибка сети. Попробуйте снова.",
      "passwordsDoNotMatch": "Пароли не совпадают.",
      "invalidPassword": "Недопустимый пароль.",
      "setPasswordFailed": "Не удалось установить пароль. Попробуйте снова.",
      "goToSignIn": "Перейти ко входу",
      "successTitle": "Пароль успешно установлен",
      "successDescription": "Теперь вы можете войти, используя электронную почту и новый пароль.",
      "successDescriptionWithCompany": "Теперь вы можете войти в {companyName}, используя электронную почту и новый пароль.",
      "signIn": "Войти",
      "settingUpAccess": "Настройка доступа к {companyName}",
      "title": "Установите пароль",
      "welcomeWithName": "Добро пожаловать, {displayName}. Выберите пароль для завершения настройки учётной записи.",
      "choosePassword": "Выберите пароль для завершения настройки учётной записи.",
      "accountLabel": "Учётная запись:",
      "passwordLabel": "Пароль",
      "confirmPasswordLabel": "Подтвердите пароль",
      "passwordPlaceholder": "Не менее {min} символов",
      "confirmPasswordPlaceholder": "Повторите пароль",
      "settingPassword": "Установка пароля…",
      "submitButton": "Установить пароль и активировать",
      "alreadyHavePassword": "Уже есть пароль?",
      "signInLink": "Войти"
    },
    "changeWorkPassword": {
      "sessionExpiredNoToken": "Сессия входа истекла. Войдите снова с временным паролем.",
      "sessionExpiredInvalid": "Сессия входа истекла или недействительна. Войдите снова с временным паролем.",
      "networkError": "Ошибка сети. Попробуйте снова.",
      "sameAsTemporary": "Выберите новый пароль, отличный от временного.",
      "saveFailed": "Не удалось сохранить новый пароль. Попробуйте снова.",
      "deskSyncFailed": "Ваш пароль Work App был обновлен, но синхронизация Work Desk не удалась. Пожалуйста, попробуйте еще раз или обратитесь к администратору.",
      "deskSyncDetailLabel": "Подробности",
      "retryDeskSyncButton": "Повторить синхронизацию Work Desk",
      "retryingDeskSync": "Повторная попытка синхронизации Work Desk…",
      "goToSignIn": "Перейти ко входу",
      "title": "Установите рабочий пароль",
      "description": "Используется для Work App и Work Desk — не пароль портала учётной записи на account.vouus.com.",
      "accountLabel": "Учётная запись:",
      "newPasswordLabel": "Новый пароль",
      "confirmPasswordLabel": "Подтвердите пароль",
      "passwordPlaceholder": "Не менее {min} символов",
      "confirmPasswordPlaceholder": "Повторите пароль",
      "passwordsDoNotMatch": "Пароли не совпадают",
      "saving": "Сохранение пароля…",
      "submitButton": "Сохранить пароль и продолжить",
      "needHelp": "Нужна помощь?",
      "returnToSignIn": "Вернуться ко входу"
    }
  },
  "meta": {
    "productRepo": "core-platform",
    "sourcePath": "apps/employee-web/dictionaries/en.json#auth",
    "githubPath": "app/auth.page.json",
    "importedFrom": "apps/employee-web/dictionaries/ru.json#auth"
  }
}
