{
  "pageId": "account.integrations.xero_migration",
  "surface": "account",
  "route": "/integrations/xero/migration/:jobId",
  "version": 1,
  "sourceHash": "sha256:ac954eeb90ec840750fb390bad8f425fe1eb4b013359cb4efc88bdecae2c8777",
  "keys": {
    "title": "مهمة ترحيل Xero",
    "subtitleLoading": "جارٍ تحميل حالة المهمة…",
    "jobIdPrefix": "المهمة",
    "statusLabel": "الحالة",
    "modeLabel": "الوضع",
    "targetErpLabel": "نظام ERP الهدف",
    "entitiesExtractedTitle": "الكيانات المستخرجة",
    "validationLabel": "التحقق — أخطاء المستوى L1: {l1}، تحذيرات المستوى L2: {l2}",
    "attachmentLoadLabel": "تحميل المرفقات — تم الرفع: {uploaded}، تم التخطي: {skipped}، الأخطاء: {errors}",
    "reconcilePassed": "تسوية ميزان المراجعة L3: ناجحة",
    "reconcileNeedsReview": "تسوية ميزان المراجعة L3: تحتاج إلى مراجعة",
    "reconcileAccountsSuffix": "{count} حسابات",
    "reconcileOutOfTolerance": "{count} خارج نطاق التفاوت المسموح",
    "columnAccount": "الحساب",
    "columnXero": "Xero",
    "columnErp": "ERP",
    "columnDelta": "الفارق",
    "columnReasons": "الأسباب",
    "agingReconcileTitle": "تسوية أعمار الذمم المدينة/الدائنة",
    "agingPassed": "ناجحة",
    "agingNeedsReview": "تحتاج إلى مراجعة",
    "agingSkipped": "تم التخطي ({reason})",
    "agingCompare": "Xero {source} مقابل ERP {target} (الفارق {delta})",
    "rawSummaryLabel": "ملخص JSON الخام",
    "jobNotAvailable": "المهمة غير متاحة.",
    "loadFailed": "فشل التحميل"
  },
  "meta": {
    "productRepo": "core-platform",
    "sourcePath": "apps/admin-web /integrations/xero/migration/:jobId",
    "githubPath": "account/integrations.xero_migration.page.json",
    "translationStatus": "ai_draft",
    "method": "cursor-ai"
  }
}
